{
  "artifact_package_schema_version": "1.1.0",
  "artifact_type": "RESULT",
  "artifact_id": "RESULT_TASK_TEMPLATE_ATTEMPT_001",
  "task_id": "TASK_TEMPLATE",
  "role": "developer",
  "attempt_no": 1,
  "status": "pass",
  "main_document": "RESULT.md",
  "structured_artifacts": [
    "structured/result_package.json"
  ],
  "evidence_refs": "NONE",
  "created_at": "2026-05-22T00:00:00Z",
  "producer": {
    "agent_instance_id": "developer_TASK_TEMPLATE_attempt_001",
    "role": "developer"
  }
}
